{
  "schemaVersion": "1.0",
  "familyId": "P4E-MAPPING-ACTION-OUTCOMES",
  "title": "P4-E human mapping and binding action outcomes",
  "ownerRole": "SPEC_AUTHOR",
  "risk": "R2",
  "lifecycle": "ACTIVE",
  "applicabilityTriggers": ["TRIGGER_1_SHARED_RECEIPT_MODEL", "TRIGGER_2_OUTCOME_CONTROLS_FIELDS", "TRIGGER_3_EXACT_COUNTER_RELATIONS", "TRIGGER_4_MULTIPLE_VALIDATOR_SURFACES", "TRIGGER_5_LIFECYCLE_TRANSITIONS"],
  "contractSources": [{"path": "docs/decisions/DESIGN_2026-08-29_P4E_IDENTITY_CONVERSATION_ROUTING.md", "sha256": "2d0975a301a15c7b8a85eba121410391ddca2f067b16d9c5089d79edb9c397b9", "canonicalization": "UTF8_UNIVERSAL_NEWLINE"}],
  "representationSurfaces": ["PYTHON_MODEL", "JSON_SCHEMA", "SQL_STATE"],
  "parityMode": "APPLICABLE",
  "closedTopLevelObject": true,
  "outcomes": [
    {"outcomeId": "APPLIED", "shapes": [{"shapeId": "P4E_ACTION_APPLIED", "requiredFields": ["outcome", "action", "aggregate_id", "aggregate_version", "audit_id", "command_application_count", "audit_count", "replayed"], "forbiddenFields": ["reason"], "conditionalRules": [], "fieldDomains": {"outcome": {"type": "STRING", "const": "APPLIED"}, "action": {"type": "STRING", "enum": ["PROPOSE", "CONFIRM", "REJECT", "REVOKE", "CORRECT", "BIND", "REPLACE_BINDING", "PRIVACY_DELETE"]}, "aggregate_id": {"type": "STRING", "minLength": 1}, "aggregate_version": {"type": "INTEGER"}, "audit_id": {"type": "STRING", "minLength": 1}, "command_application_count": {"type": "INTEGER", "const": 1}, "audit_count": {"type": "INTEGER", "const": 1}, "replayed": {"type": "BOOLEAN", "const": false}}, "relations": [{"relationId": "APPLIED_COMMAND_ONE", "kind": "COUNTER_EQUALITY", "field": "command_application_count", "value": 1}, {"relationId": "APPLIED_AUDIT_ONE", "kind": "COUNTER_EQUALITY", "field": "audit_count", "value": 1}]}]},
    {"outcomeId": "IDEMPOTENT_REPLAY", "shapes": [{"shapeId": "P4E_ACTION_REPLAY", "requiredFields": ["outcome", "action", "aggregate_id", "aggregate_version", "audit_id", "command_application_count", "audit_count", "replayed"], "forbiddenFields": ["reason"], "conditionalRules": [], "fieldDomains": {"outcome": {"type": "STRING", "const": "IDEMPOTENT_REPLAY"}, "action": {"type": "STRING", "enum": ["PROPOSE", "CONFIRM", "REJECT", "REVOKE", "CORRECT", "BIND", "REPLACE_BINDING", "PRIVACY_DELETE"]}, "aggregate_id": {"type": "STRING", "minLength": 1}, "aggregate_version": {"type": "INTEGER"}, "audit_id": {"type": "STRING", "minLength": 1}, "command_application_count": {"type": "INTEGER", "const": 0}, "audit_count": {"type": "INTEGER", "const": 0}, "replayed": {"type": "BOOLEAN", "const": true}}, "relations": [{"relationId": "REPLAY_COMMAND_ZERO", "kind": "COUNTER_EQUALITY", "field": "command_application_count", "value": 0}, {"relationId": "REPLAY_AUDIT_ZERO", "kind": "COUNTER_EQUALITY", "field": "audit_count", "value": 0}]}]},
    {"outcomeId": "REFUSED", "shapes": [{"shapeId": "P4E_ACTION_REFUSED", "requiredFields": ["outcome", "action", "reason", "command_application_count", "audit_count", "replayed"], "forbiddenFields": ["aggregate_id", "aggregate_version", "audit_id"], "conditionalRules": [], "fieldDomains": {"outcome": {"type": "STRING", "const": "REFUSED"}, "action": {"type": "STRING", "enum": ["PROPOSE", "CONFIRM", "REJECT", "REVOKE", "CORRECT", "BIND", "REPLACE_BINDING", "PRIVACY_DELETE"]}, "reason": {"type": "STRING", "enum": ["IDENTITY_REQUIRED", "PERMISSION_DENIED", "ACTOR_INACTIVE", "ROLE_CHANGED", "SCOPE_MISMATCH", "SEPARATION_OF_DUTY", "TARGET_INELIGIBLE", "SENDER_MISMATCH", "INVALID_LIFECYCLE", "UNSUPPORTED_TARGET", "SECRET_ERASURE_FAILED"]}, "command_application_count": {"type": "INTEGER", "const": 0}, "audit_count": {"type": "INTEGER", "const": 0}, "replayed": {"type": "BOOLEAN", "const": false}}, "relations": [{"relationId": "REFUSED_COMMAND_ZERO", "kind": "COUNTER_EQUALITY", "field": "command_application_count", "value": 0}, {"relationId": "REFUSED_AUDIT_ZERO", "kind": "COUNTER_EQUALITY", "field": "audit_count", "value": 0}]}]},
    {"outcomeId": "CONFLICT", "shapes": [{"shapeId": "P4E_ACTION_CONFLICT", "requiredFields": ["outcome", "action", "reason", "command_application_count", "audit_count", "replayed"], "forbiddenFields": ["aggregate_id", "aggregate_version", "audit_id"], "conditionalRules": [], "fieldDomains": {"outcome": {"type": "STRING", "const": "CONFLICT"}, "action": {"type": "STRING", "enum": ["PROPOSE", "CONFIRM", "REJECT", "REVOKE", "CORRECT", "BIND", "REPLACE_BINDING", "PRIVACY_DELETE"]}, "reason": {"type": "STRING", "enum": ["VERSION_CONFLICT", "IDEMPOTENCY_CONFLICT", "CURRENT_MAPPING_CONFLICT", "CURRENT_BINDING_CONFLICT", "LINEAGE_COLLISION", "CORRUPT_STATE"]}, "command_application_count": {"type": "INTEGER", "const": 0}, "audit_count": {"type": "INTEGER", "const": 0}, "replayed": {"type": "BOOLEAN", "const": false}}, "relations": [{"relationId": "CONFLICT_COMMAND_ZERO", "kind": "COUNTER_EQUALITY", "field": "command_application_count", "value": 0}, {"relationId": "CONFLICT_AUDIT_ZERO", "kind": "COUNTER_EQUALITY", "field": "audit_count", "value": 0}]}]}
  ],
  "mutationPolicy": {"excludedOperators": [{"operator": "RECURSE_NESTED_OBJECTS", "shapeId": "P4E_ACTION_APPLIED", "reason": "Flat receipt shape.", "independentReviewRequired": true}, {"operator": "RECURSE_NESTED_OBJECTS", "shapeId": "P4E_ACTION_REPLAY", "reason": "Flat receipt shape.", "independentReviewRequired": true}, {"operator": "RECURSE_NESTED_OBJECTS", "shapeId": "P4E_ACTION_REFUSED", "reason": "Flat receipt shape.", "independentReviewRequired": true}, {"operator": "RECURSE_NESTED_OBJECTS", "shapeId": "P4E_ACTION_CONFLICT", "reason": "Flat receipt shape.", "independentReviewRequired": true}]},
  "ownershipBindings": [{"bindingId": "P4E_MAPPING_MATRIX_DIGEST", "ownerPath": "docs/cvf/invariants/p4e-mapping-action-outcomes.json", "consumers": [{"consumerPath": "docs/specs/p4e_invariant_pins.py", "strategy": "CANONICAL_DIGEST", "digestSymbol": "P4E_MAPPING_ACTION_MATRIX_CANONICAL_DIGEST"}]}],
  "emitterAdapter": {"identity": "p4e_spec_mapping_positive_examples", "kind": "SYNTHETIC_DETERMINISTIC"},
  "evidenceTestPaths": ["tests/unit/test_invariant_family_contract.py", "tests/integration/test_invariant_family_repository_guard.py"],
  "boundedClaim": "Defines sanitized P4-E mapping and binding action receipt shapes and exact command-application/audit facts only; no runtime, provider, deployment, or external-identity truth claim."
}
