{
  "schemaVersion": "1.0",
  "familyId": "P4E-CONVERSATION-PLACEMENT-OUTCOMES",
  "title": "P4-E deterministic proposal placement outcomes",
  "ownerRole": "SPEC_AUTHOR",
  "risk": "R2",
  "lifecycle": "ACTIVE",
  "applicabilityTriggers": ["TRIGGER_1_SHARED_RESULT_MODEL", "TRIGGER_2_OUTCOME_CONTROLS_FIELDS", "TRIGGER_3_EXACT_COUNTER_RELATIONS", "TRIGGER_4_MULTIPLE_VALIDATOR_SURFACES", "TRIGGER_5_RETRY_TERMINAL_FAMILY"],
  "contractSources": [{"path": "docs/decisions/DESIGN_2026-08-29_P4E_IDENTITY_CONVERSATION_ROUTING.md", "sha256": "2d0975a301a15c7b8a85eba121410391ddca2f067b16d9c5089d79edb9c397b9", "canonicalization": "UTF8_UNIVERSAL_NEWLINE"}],
  "representationSurfaces": ["PYTHON_MODEL", "JSON_SCHEMA", "SQL_STATE"],
  "parityMode": "APPLICABLE",
  "closedTopLevelObject": true,
  "outcomes": [
    {"outcomeId": "PLACED", "shapes": [{"shapeId": "P4E_PLACED", "requiredFields": ["outcome", "decision_id", "proposal_id", "mapping_id", "binding_id", "target_kind", "target_id", "conversation_key", "decision_count", "work_complete"], "forbiddenFields": ["reason"], "conditionalRules": [], "fieldDomains": {"outcome": {"type": "STRING", "const": "PLACED"}, "decision_id": {"type": "STRING", "minLength": 1}, "proposal_id": {"type": "STRING", "minLength": 1}, "mapping_id": {"type": "STRING", "minLength": 1}, "binding_id": {"type": "STRING", "minLength": 1}, "target_kind": {"type": "STRING", "enum": ["WORKSPACE", "SHIFT", "INCIDENT"]}, "target_id": {"type": "STRING", "minLength": 1}, "conversation_key": {"type": "STRING", "pattern": "^[0-9a-f]{64}$"}, "decision_count": {"type": "INTEGER", "const": 1}, "work_complete": {"type": "BOOLEAN", "const": true}}, "relations": [{"relationId": "PLACED_DECISION_ONE", "kind": "COUNTER_EQUALITY", "field": "decision_count", "value": 1}]}]},
    {"outcomeId": "FALLBACK", "shapes": [{"shapeId": "P4E_PLACEMENT_FALLBACK", "requiredFields": ["outcome", "reason", "decision_id", "proposal_id", "decision_count", "work_complete"], "forbiddenFields": ["mapping_id", "binding_id", "target_kind", "target_id", "conversation_key"], "conditionalRules": [], "fieldDomains": {"outcome": {"type": "STRING", "const": "FALLBACK"}, "reason": {"type": "STRING", "enum": ["LEGACY_SENDER_EVIDENCE", "NO_SENDER_EVIDENCE", "NO_MAPPING", "MAPPING_REJECTED", "MAPPING_REVOKED", "TARGET_USER_INACTIVE", "NO_BINDING", "UNSUPPORTED_TARGET"]}, "decision_id": {"type": "STRING", "minLength": 1}, "proposal_id": {"type": "STRING", "minLength": 1}, "decision_count": {"type": "INTEGER", "const": 1}, "work_complete": {"type": "BOOLEAN", "const": true}}, "relations": [{"relationId": "FALLBACK_DECISION_ONE", "kind": "COUNTER_EQUALITY", "field": "decision_count", "value": 1}]}]},
    {"outcomeId": "REFUSED", "shapes": [{"shapeId": "P4E_PLACEMENT_REFUSED", "requiredFields": ["outcome", "reason", "decision_id", "proposal_id", "decision_count", "work_complete"], "forbiddenFields": ["mapping_id", "binding_id", "target_kind", "target_id", "conversation_key"], "conditionalRules": [], "fieldDomains": {"outcome": {"type": "STRING", "const": "REFUSED"}, "reason": {"type": "STRING", "enum": ["LINEAGE_COLLISION", "MULTIPLE_CURRENT_MAPPINGS", "MULTIPLE_CURRENT_BINDINGS", "STALE_MAPPING_VERSION", "STALE_BINDING_VERSION", "TARGET_STATE_AMBIGUOUS", "ASSIGNMENT_INELIGIBLE", "RETRY_EXHAUSTED", "CORRUPT_STATE"]}, "decision_id": {"type": "STRING", "minLength": 1}, "proposal_id": {"type": "STRING", "minLength": 1}, "decision_count": {"type": "INTEGER", "const": 1}, "work_complete": {"type": "BOOLEAN", "const": true}}, "relations": [{"relationId": "REFUSED_DECISION_ONE", "kind": "COUNTER_EQUALITY", "field": "decision_count", "value": 1}]}]},
    {"outcomeId": "RETRY_PENDING", "shapes": [{"shapeId": "P4E_PLACEMENT_RETRY_PENDING", "requiredFields": ["outcome", "reason", "proposal_id", "decision_count", "work_complete"], "forbiddenFields": ["decision_id", "mapping_id", "binding_id", "target_kind", "target_id", "conversation_key"], "conditionalRules": [], "fieldDomains": {"outcome": {"type": "STRING", "const": "RETRY_PENDING"}, "reason": {"type": "STRING", "enum": ["AUTHORITY_STORE_UNAVAILABLE", "TARGET_STORE_UNAVAILABLE", "TRANSACTION_ROLLED_BACK", "CLAIM_RECOVERABLE"]}, "proposal_id": {"type": "STRING", "minLength": 1}, "decision_count": {"type": "INTEGER", "const": 0}, "work_complete": {"type": "BOOLEAN", "const": false}}, "relations": [{"relationId": "RETRY_DECISION_ZERO", "kind": "COUNTER_EQUALITY", "field": "decision_count", "value": 0}]}]}
  ],
  "mutationPolicy": {"excludedOperators": [{"operator": "RECURSE_NESTED_OBJECTS", "shapeId": "P4E_PLACED", "reason": "Flat result shape.", "independentReviewRequired": true}, {"operator": "RECURSE_NESTED_OBJECTS", "shapeId": "P4E_PLACEMENT_FALLBACK", "reason": "Flat result shape.", "independentReviewRequired": true}, {"operator": "RECURSE_NESTED_OBJECTS", "shapeId": "P4E_PLACEMENT_REFUSED", "reason": "Flat result shape.", "independentReviewRequired": true}, {"operator": "RECURSE_NESTED_OBJECTS", "shapeId": "P4E_PLACEMENT_RETRY_PENDING", "reason": "Flat result shape.", "independentReviewRequired": true}]},
  "ownershipBindings": [{"bindingId": "P4E_PLACEMENT_MATRIX_DIGEST", "ownerPath": "docs/cvf/invariants/p4e-placement-outcomes.json", "consumers": [{"consumerPath": "docs/specs/p4e_invariant_pins.py", "strategy": "CANONICAL_DIGEST", "digestSymbol": "P4E_PLACEMENT_MATRIX_CANONICAL_DIGEST"}]}],
  "emitterAdapter": {"identity": "p4e_spec_placement_positive_examples", "kind": "SYNTHETIC_DETERMINISTIC"},
  "evidenceTestPaths": ["tests/unit/test_invariant_family_contract.py", "tests/integration/test_invariant_family_repository_guard.py"],
  "boundedClaim": "Defines proposal placement, non-privileged fallback, fail-closed refusal, and pending-retry result shapes only; no operational-truth or exactly-once claim."
}
