{
  "schemaVersion": "1.0", "familyId": "P4C-OUTBOUND-TERMINAL-OUTCOMES",
  "title": "P4-C outbound terminal outcomes and exact delivery attempts",
  "ownerRole": "SPEC_AUTHOR", "risk": "R2", "lifecycle": "ACTIVE",
  "applicabilityTriggers": ["TRIGGER_1_SHARED_RECEIPT_MODEL", "TRIGGER_2_OUTCOME_CONTROLS_FIELDS", "TRIGGER_3_EXACT_COUNTER_RELATIONS", "TRIGGER_4_MULTIPLE_VALIDATOR_SURFACES"],
  "contractSources": [{"path": "docs/decisions/DESIGN_2026-08-23_P4C_INTEGRATION_EDGE.md", "sha256": "b141320a5a4fc828c7d2b6d0a318009ce131e844e24537222c9174ae391a2137", "canonicalization": "UTF8_UNIVERSAL_NEWLINE"}],
  "representationSurfaces": ["PYTHON_MODEL", "JSON_SCHEMA", "SQL_STATE"], "parityMode": "APPLICABLE", "closedTopLevelObject": true,
  "outcomes": [
    {"outcomeId": "NOT_ATTEMPTED", "shapes": [{"shapeId": "NOT_ATTEMPTED_VALID", "requiredFields": ["outcome", "reason", "command_id", "delivery_attempts"], "forbiddenFields": ["delivery_id"], "conditionalRules": [], "fieldDomains": {"outcome": {"type": "STRING", "const": "NOT_ATTEMPTED"}, "reason": {"type": "STRING", "enum": ["AUTH_REFUSED", "PREREQUISITE_REFUSED", "ADAPTER_UNAVAILABLE"]}, "command_id": {"type": "STRING", "minLength": 1}, "delivery_attempts": {"type": "INTEGER", "const": 0}}, "relations": [{"relationId": "NOT_ATTEMPTED_ZERO", "kind": "COUNTER_EQUALITY", "field": "delivery_attempts", "value": 0}]}]},
    {"outcomeId": "SENT_ACCEPTED", "shapes": [{"shapeId": "SENT_ACCEPTED_VALID", "requiredFields": ["outcome", "command_id", "delivery_id", "delivery_attempts"], "forbiddenFields": ["reason"], "conditionalRules": [], "fieldDomains": {"outcome": {"type": "STRING", "const": "SENT_ACCEPTED"}, "command_id": {"type": "STRING", "minLength": 1}, "delivery_id": {"type": "STRING", "minLength": 1}, "delivery_attempts": {"type": "INTEGER", "const": 1}}, "relations": [{"relationId": "SENT_ACCEPTED_ONE", "kind": "COUNTER_EQUALITY", "field": "delivery_attempts", "value": 1}]}]},
    {"outcomeId": "DELIVERED", "shapes": [{"shapeId": "DELIVERED_VALID", "requiredFields": ["outcome", "command_id", "delivery_id", "delivery_attempts"], "forbiddenFields": ["reason"], "conditionalRules": [], "fieldDomains": {"outcome": {"type": "STRING", "const": "DELIVERED"}, "command_id": {"type": "STRING", "minLength": 1}, "delivery_id": {"type": "STRING", "minLength": 1}, "delivery_attempts": {"type": "INTEGER", "const": 1}}, "relations": [{"relationId": "DELIVERED_ONE", "kind": "COUNTER_EQUALITY", "field": "delivery_attempts", "value": 1}]}]},
    {"outcomeId": "PROVIDER_REFUSED", "shapes": [{"shapeId": "PROVIDER_REFUSED_VALID", "requiredFields": ["outcome", "reason", "command_id", "delivery_attempts"], "forbiddenFields": ["delivery_id"], "conditionalRules": [], "fieldDomains": {"outcome": {"type": "STRING", "const": "PROVIDER_REFUSED"}, "reason": {"type": "STRING", "const": "PROVIDER_REFUSED"}, "command_id": {"type": "STRING", "minLength": 1}, "delivery_attempts": {"type": "INTEGER", "const": 1}}, "relations": [{"relationId": "PROVIDER_REFUSED_ONE", "kind": "COUNTER_EQUALITY", "field": "delivery_attempts", "value": 1}]}]},
    {"outcomeId": "RATE_LIMITED", "shapes": [{"shapeId": "RATE_LIMITED_VALID", "requiredFields": ["outcome", "reason", "command_id", "delivery_attempts"], "forbiddenFields": ["delivery_id"], "conditionalRules": [], "fieldDomains": {"outcome": {"type": "STRING", "const": "RATE_LIMITED"}, "reason": {"type": "STRING", "const": "RATE_LIMITED"}, "command_id": {"type": "STRING", "minLength": 1}, "delivery_attempts": {"type": "INTEGER", "const": 0}}, "relations": [{"relationId": "RATE_LIMITED_ZERO", "kind": "COUNTER_EQUALITY", "field": "delivery_attempts", "value": 0}]}]},
    {"outcomeId": "OUTCOME_UNKNOWN", "shapes": [{"shapeId": "OUTCOME_UNKNOWN_VALID", "requiredFields": ["outcome", "reason", "command_id", "delivery_attempts"], "forbiddenFields": ["delivery_id"], "conditionalRules": [], "fieldDomains": {"outcome": {"type": "STRING", "const": "OUTCOME_UNKNOWN"}, "reason": {"type": "STRING", "const": "AMBIGUOUS_TRANSPORT"}, "command_id": {"type": "STRING", "minLength": 1}, "delivery_attempts": {"type": "INTEGER", "const": 1}}, "relations": [{"relationId": "OUTCOME_UNKNOWN_ONE", "kind": "COUNTER_EQUALITY", "field": "delivery_attempts", "value": 1}]}]},
    {"outcomeId": "TERMINAL_FAILED", "shapes": [{"shapeId": "TERMINAL_FAILED_VALID", "requiredFields": ["outcome", "reason", "command_id", "delivery_attempts"], "forbiddenFields": ["delivery_id"], "conditionalRules": [], "fieldDomains": {"outcome": {"type": "STRING", "const": "TERMINAL_FAILED"}, "reason": {"type": "STRING", "enum": ["INVALID_RESPONSE", "NONRETRYABLE_ERROR"]}, "command_id": {"type": "STRING", "minLength": 1}, "delivery_attempts": {"type": "INTEGER", "const": 1}}, "relations": [{"relationId": "TERMINAL_FAILED_ONE", "kind": "COUNTER_EQUALITY", "field": "delivery_attempts", "value": 1}]}]}
  ],
  "mutationPolicy": {"excludedOperators": [
    {"operator": "RECURSE_NESTED_OBJECTS", "shapeId": "NOT_ATTEMPTED_VALID", "reason": "Flat receipt shape.", "independentReviewRequired": true},
    {"operator": "RECURSE_NESTED_OBJECTS", "shapeId": "SENT_ACCEPTED_VALID", "reason": "Flat receipt shape.", "independentReviewRequired": true},
    {"operator": "RECURSE_NESTED_OBJECTS", "shapeId": "DELIVERED_VALID", "reason": "Flat receipt shape.", "independentReviewRequired": true},
    {"operator": "RECURSE_NESTED_OBJECTS", "shapeId": "PROVIDER_REFUSED_VALID", "reason": "Flat receipt shape.", "independentReviewRequired": true},
    {"operator": "RECURSE_NESTED_OBJECTS", "shapeId": "RATE_LIMITED_VALID", "reason": "Flat receipt shape.", "independentReviewRequired": true},
    {"operator": "RECURSE_NESTED_OBJECTS", "shapeId": "OUTCOME_UNKNOWN_VALID", "reason": "Flat receipt shape.", "independentReviewRequired": true},
    {"operator": "RECURSE_NESTED_OBJECTS", "shapeId": "TERMINAL_FAILED_VALID", "reason": "Flat receipt shape.", "independentReviewRequired": true}
  ]},
  "ownershipBindings": [{"bindingId": "P4C_OUTBOUND_MATRIX_DIGEST_BINDING", "ownerPath": "docs/cvf/invariants/p4c-outbound-terminal-outcomes.json", "consumers": [{"consumerPath": "docs/specs/p4c_invariant_pins.py", "strategy": "CANONICAL_DIGEST", "digestSymbol": "P4C_OUTBOUND_MATRIX_CANONICAL_DIGEST"}]}],
  "emitterAdapter": {"identity": "integration_edge.invariants:emit_outbound_terminal_receipt", "kind": "REAL_SERVICE_EMITTER"},
  "evidenceTestPaths": ["tests/unit/test_invariant_family_contract.py", "tests/integration/test_invariant_family_repository_guard.py"],
  "boundedClaim": "Defines P4-C outbound receipt shapes and exact delivery-attempt counters only; no real adapter, provider call, production send, deployment, or business-truth claim."
}
